<?xml version="1.0" encoding="UTF-8"?>
<xs:schema xmlns:xs="http://www.w3.org/2001/XMLSchema">

    <xs:element name="contacts">
        <xs:complexType>
            <xs:sequence>
                <xs:element name="contact" maxOccurs="unbounded">
                    <xs:complexType>
                        <xs:sequence>
                            <xs:element name="nom" type="xs:string"/>
                            <xs:element name="prenom" type="xs:string" minOccurs="0"/>
                            <xs:element name="telephone" type="xs:string"/>
                            <xs:element name="adresse">
                                <xs:complexType>
                                    <xs:sequence>
                                        <xs:element name="rue" type="xs:string"/>
                                        <xs:element name="numero" type="xs:int"/>
                                        <xs:element name="ville" type="xs:string"/>
                                        <xs:element name="code_postal" type="xs:string"/>
                                        <xs:element name="pays" type="xs:string"/>
                                    </xs:sequence>
                                </xs:complexType>
                            </xs:element>
                        </xs:sequence>
                        <!-- Definition de l'attribut -->
                        <xs:attribute name="type" type="xs:string" use="required"/>
                    </xs:complexType>
                </xs:element>
            </xs:sequence>
        </xs:complexType>
    </xs:element>

</xs:schema>